{
  "planId": "plan-dn-2day",
  "title": "Da Nang and Hoi An 2-Day Itinerary",
  "destinationId": "DN",
  "days": [
    {
      "dayNumber": 1,
      "date": "2026-12-01",
      "activities": [
        {
          "activityId": "act-1",
          "placeId": "DN-ATT-001",
          "type": "sightseeing",
          "startTime": "09:00",
          "endTime": "11:00",
          "estimatedCostVnd": null,
          "costStatus": "NO_DATA",
          "reason": "Visit Ngu Hanh Son for nature and culture exploration."
        },
        {
          "activityId": "act-2",
          "placeId": "DN-DIN-001",
          "type": "dining",
          "startTime": "11:30",
          "endTime": "12:30",
          "estimatedCostVnd": null,
          "costStatus": "NO_DATA",
          "reason": "Enjoy authentic mi Quang."
        },
        {
          "activityId": "act-3",
          "placeId": "DN-ATT-002",
          "type": "sightseeing",
          "startTime": "14:00",
          "endTime": "17:00",
          "estimatedCostVnd": null,
          "costStatus": "NO_DATA",
          "reason": "Explore cultural sights in Hoi An Ancient Town."
        }
      ],
      "travelLegs": [
        {
          "fromPlaceId": "DN-ATT-001",
          "toPlaceId": "DN-DIN-001",
          "durationMin": null,
          "distanceKm": null
        },
        {
          "fromPlaceId": "DN-DIN-001",
          "toPlaceId": "DN-ATT-002",
          "durationMin": null,
          "distanceKm": null
        }
      ]
    },
    {
      "dayNumber": 2,
      "date": "2026-12-02",
      "activities": [
        {
          "activityId": "act-4",
          "placeId": "DN-ATT-003",
          "type": "sightseeing",
          "startTime": "09:00",
          "endTime": "11:00",
          "estimatedCostVnd": 0,
          "costStatus": "UNVERIFIED",
          "reason": "Relax at My Khe Beach."
        },
        {
          "activityId": "act-5",
          "placeId": "DN-DIN-002",
          "type": "dining",
          "startTime": "11:30",
          "endTime": "12:45",
          "estimatedCostVnd": null,
          "costStatus": "NO_DATA",
          "reason": "Savor local seafood."
        }
      ],
      "travelLegs": [
        {
          "fromPlaceId": "DN-ATT-003",
          "toPlaceId": "DN-DIN-002",
          "durationMin": null,
          "distanceKm": null
        }
      ]
    }
  ],
  "missingData": [
    "Prices for Ngu Hanh Son, Hoi An Ancient Town, Quan mi Quang, and Quan hai san",
    "Operating hours for all listed locations",
    "Travel duration and distance between itinerary places"
  ],
  "assumptions": [
    "Trip starts on 2026-12-01",
    "Activities operate during standard daylight hours"
  ]
}
