{
  "planId": "plan-dn-2day-202612",
  "title": "Hành trình Đà Nẵng - Hội An 2 ngày",
  "destinationId": "DN",
  "days": [
    {
      "dayNumber": 1,
      "date": "2026-12-01",
      "activities": [
        {
          "activityId": "act-001",
          "placeId": "DN-ATT-001",
          "type": "sightseeing",
          "startTime": "08:00",
          "endTime": "10:00",
          "estimatedCostVnd": null,
          "costStatus": "NO_DATA",
          "reason": "Khám phá văn hóa và thiên nhiên tại Ngũ Hành Sơn."
        },
        {
          "activityId": "act-002",
          "placeId": "DN-DIN-001",
          "type": "dining",
          "startTime": "10:30",
          "endTime": "11:30",
          "estimatedCostVnd": null,
          "costStatus": "NO_DATA",
          "reason": "Thưởng thức món Mì Quảng theo sở thích."
        },
        {
          "activityId": "act-003",
          "placeId": "DN-ATT-002",
          "type": "sightseeing",
          "startTime": "12:00",
          "endTime": "15:00",
          "estimatedCostVnd": null,
          "costStatus": "NO_DATA",
          "reason": "Trải nghiệm không gian văn hóa Phố cổ Hội An."
        }
      ],
      "travelLegs": [
        {
          "fromPlaceId": "DN-ATT-001",
          "toPlaceId": "DN-DIN-001",
          "durationMin": null,
          "distanceKm": null
        },
        {
          "fromPlaceId": "DN-DIN-001",
          "toPlaceId": "DN-ATT-002",
          "durationMin": null,
          "distanceKm": null
        }
      ]
    },
    {
      "dayNumber": 2,
      "date": "2026-12-02",
      "activities": [
        {
          "activityId": "act-004",
          "placeId": "DN-ATT-003",
          "type": "sightseeing",
          "startTime": "08:00",
          "endTime": "10:00",
          "estimatedCostVnd": 0,
          "costStatus": "UNVERIFIED",
          "reason": "Thư giãn tại bãi biển Mỹ Khê."
        },
        {
          "activityId": "act-005",
          "placeId": "DN-DIN-002",
          "type": "dining",
          "startTime": "10:30",
          "endTime": "11:45",
          "estimatedCostVnd": null,
          "costStatus": "NO_DATA",
          "reason": "Thưởng thức hải sản địa phương."
        }
      ],
      "travelLegs": [
        {
          "fromPlaceId": "DN-ATT-003",
          "toPlaceId": "DN-DIN-002",
          "durationMin": null,
          "distanceKm": null
        }
      ]
    }
  ],
  "missingData": [
    "Giờ mở cửa của các điểm tham quan và ăn uống",
    "Chi phí chi tiết của DN-ATT-001, DN-ATT-002, DN-DIN-001, DN-DIN-002",
    "Thời gian và khoảng cách di chuyển trong travel matrix"
  ],
  "assumptions": [
    "Các điểm tham quan mở cửa vào thời gian dự kiến trong lịch trình",
    "Thời gian di chuyển thực tế sẽ được cập nhật khi có thông tin chi tiết"
  ]
}
